{
  "schema_version": 1,
  "id": "fix-ai-workflow-validation-and-artifact-safety",
  "title": "Harden benchmark artifact upload and AI-workflow validation tests",
  "status": "archived",
  "type": "security",
  "risk_level": "high",
  "created_at": "2026-08-08T20:52:55Z",
  "updated_at": "2026-08-09T10:44:35Z",
  "owners": {
    "planner": "perplexity",
    "implementer": "deepcode",
    "approver": "human"
  },
  "git": {
    "base_branch": "main",
    "working_branch": "",
    "pull_request": null
  },
  "scope": {
    "allowed_paths": [],
    "forbidden_paths": [],
    "max_changed_files": null
  },
  "requirements": {
    "must_have": [],
    "must_not": []
  },
  "validation": {
    "required_checks": [],
    "required_test_commands": [],
    "requires_benchmark": false,
    "requires_reference_equivalence": false,
    "requires_adr": false,
    "requires_human_approval": true
  },
  "artifacts": {
    "design": "design.md",
    "acceptance": "acceptance.md",
    "implementation_report": "implementation_report.md",
    "benchmark_report": null,
    "rollback_plan": "rollback_plan.md"
  },
  "links": {
    "issue": null,
    "pull_request": null,
    "adr": []
  }
}
