{
  "schema_version": 1,
  "id": "elem-01-halogens-isotopes",
  "title": "ELEM-01: галогены, фосфор и изотопный паттерн в назначении формул",
  "status": "implementation",
  "type": "scientific",
  "risk_level": "high",
  "created_at": "2026-10-13T09:00:00Z",
  "updated_at": "2026-10-13T09:00:00Z",
  "owners": {
    "planner": "deepcode",
    "implementer": "deepcode",
    "approver": "human"
  },
  "git": {
    "base_branch": "main",
    "working_branch": "feat/elem-01-halogens-isotopes",
    "pull_request": null
  },
  "scope": {
    "allowed_paths": [
      "src/core/spectrum/",
      "src/configs/",
      "src/ui/",
      "src/app.py",
      "tests/",
      "docs/",
      ".ai/tasks/active/elem-01-halogens-isotopes/",
      ".ai/decisions/"
    ],
    "forbidden_paths": [
      "data/",
      ".git/"
    ],
    "max_changed_files": 25
  },
  "requirements": {
    "must_have": [
      "Набор элементов расширен: C, H, O, N, S, P, F, Cl, Br, I (конфиг — единственный источник)",
      "Изотопная таблица (масса + распространённость) для всех элементов в конфиге",
      "Теоретический изотопный паттерн M/M+1/M+2 (корректно для Cl/Br/S)",
      "Для найденной формулы строятся изотопные варианты и сопоставляются с наблюдаемыми пиками",
      "S/P/галоген-формулы без изотопного подтверждения не перебивают CHNO в том же ppm-окне",
      "Совпадение M+2 даёт бонус и позволяет S/Cl/Br-формуле выиграть",
      "Исправлен DBE в скоринге (был O вместо N)",
      "GUI: диапазоны элементов строятся из конфига (новые элементы появляются автоматически)",
      "CLI не требует изменений: элементы берутся из конфига, --element-ranges поддерживает новые символы",
      "ADR-0004 зафиксирован"
    ],
    "must_not": [
      "Менять значения научных констант (массы, delta_cd3, delta_cd3co, proton_mass)",
      "Менять формат выходной таблицы",
      "Добавлять runtime-зависимости",
      "Публиковать широкие пределы X/C, S/C, P/C как дефолт без этапа 4 (сжатая база формул)"
    ]
  },
  "validation": {
    "required_checks": [
      "python tools/ai_workflow.py validate-task elem-01-halogens-isotopes",
      "python -c \"from src.core.spectrum._isotopes import pattern; print('OK')\""
    ],
    "required_test_commands": [
      "pytest tests/ -q",
      "python -m src.cli --input data/test_sets/set_01/original.csv --dmet data/test_sets/set_01/deutermethylated.csv --dacet data/test_sets/set_01/deuteroacylated.csv --sep , -o /tmp/elem01_set01.xlsx"
    ],
    "requires_benchmark": false,
    "requires_reference_equivalence": true,
    "requires_adr": true,
    "requires_human_approval": false
  },
  "artifacts": {
    "design": "design.md",
    "acceptance": "acceptance.md",
    "implementation_report": "implementation_report.md",
    "benchmark_report": null,
    "rollback_plan": "rollback_plan.md",
    "reference_validation": null
  },
  "links": {
    "issue": null,
    "pull_request": null,
    "adr": ["0004-elements-and-isotopes.md"]
  }
}
