{
  "schema_version": 1,
  "id": "fix-ai-workflow-artifact-contracts",
  "title": "Fix AI workflow artifact contracts and semantic validation",
  "status": "draft",
  "type": "security",
  "risk_level": "high",
  "created_at": "2026-08-08T20:03:44Z",
  "updated_at": "2026-08-08T20:03:44Z",
  "owners": {
    "planner": "perplexity",
    "implementer": "deepcode",
    "approver": "human"
  },
  "git": {
    "base_branch": "main",
    "working_branch": "",
    "pull_request": null
  },
  "scope": {
    "allowed_paths": [],
    "forbidden_paths": [],
    "max_changed_files": null
  },
  "requirements": {
    "must_have": [],
    "must_not": []
  },
  "validation": {
    "required_checks": [],
    "required_test_commands": [],
    "requires_benchmark": false,
    "requires_reference_equivalence": false,
    "requires_adr": false,
    "requires_human_approval": true
  },
  "artifacts": {
    "design": "design.md",
    "acceptance": "acceptance.md",
    "implementation_report": "implementation_report.md",
    "benchmark_report": null,
    "rollback_plan": "rollback_plan.md"
  },
  "links": {
    "issue": null,
    "pull_request": null,
    "adr": []
  }
}
